[
  {
    "id": "39970976",
    "pmid": "39970976",
    "doi": "10.1016/j.resuscitation.2025.110550",
    "title": "Cardiac arrest survivors' self-reported cognitive function, and its association with self-reported health status, psychological distress, and life satisfaction-a Swedish nationwide registry study.",
    "authors": [
      "Karin Larsson",
      "Carina Hjelm",
      "Anna Strömberg",
      "Johan Israelsson",
      "Anders Bremer",
      "Jens Agerström",
      "Nina Carlsson",
      "Dionysia Tsoukala",
      "Erik Blennow Nordström",
      "Kristofer Årestedt"
    ],
    "journal": "Resuscitation",
    "year": 2025,
    "date": "2025-02-17",
    "abstract": "AIM: Self-reported cognitive function has been described as an important complement to performance-based measurements but has seldom been investigated in cardiac arrest (CA) survivors. Therefore, the aim was to describe self-reported cognitive function and its association with health status, psychological distress, and life satisfaction.\nMETHODS: This study utilised data from the Swedish Register of Cardiopulmonary Resuscitation (2018-2021), registered 3-6 months post-CA. Cognitive function was assessed by a single question: \"How do you experience your memory, concentration, and/or planning abilities today compared to before the cardiac arrest?\". Health status was measured using the EQ VAS, psychological distress with the Hospital Anxiety and Depression Scale, and overall life satisfaction with the Life Satisfaction checklist. Data were analysed using binary logistic regression.\nRESULTS: Among 4026 identified survivors, 1254 fulfilled the inclusion criteria. The mean age was 65.9 years (SD = 13.4) and 31.7% were female. Self-reported cognitive function among survivors was reported as: 'Much worse' by 3.1%, 'Worse' by 23.8%, 'Unchanged' by 68.3%, 'Better' by 3.3%, and 'Much better' by 1.5%. Declined cognitive function was associated with lower health status (OR = 2.76, 95% CI = 2.09-3.64), symptoms of anxiety (OR = 3.84, 95% CI = 2.80-5.24) and depression (OR = 4.52, 95% CI = 3.22-6.32), and being dissatisfied with overall life (OR = 2.74, 95% CI = 2.11-3.54). These associations remained significant after age, sex, place of CA, aetiology, initial rhythm, initial witnessed status, and cerebral performance were controlled.\nCONCLUSIONS: Survivors experiencing declined cognitive function post-CA are at a higher risk of poorer health status, increased psychological distress, and reduced life satisfaction, and these risks should be acknowledged by healthcare professionals.",
    "links": {
      "doi": "https://doi.org/10.1016/j.resuscitation.2025.110550",
      "pubmed": "https://pubmed.ncbi.nlm.nih.gov/39970976"
    },
    "flags": {
      "open_access": false,
      "has_fulltext": false
    },
    "mesh": [
      "Humans",
      "Female",
      "Male",
      "Sweden",
      "Aged",
      "Registries",
      "Self Report",
      "Survivors",
      "Health Status",
      "Middle Aged",
      "Cognition",
      "Personal Satisfaction",
      "Psychological Distress",
      "Cardiopulmonary Resuscitation",
      "Heart Arrest"
    ],
    "country": "Sweden"
  },
  {
    "id": "41181996",
    "pmid": "41181996",
    "doi": "10.1161/JAHA.125.042637",
    "title": "Cognitive Recovery After Out-of-Hospital Cardiac Arrest: Insights Into Improvement Over 6 Months and the Role of Arrest Duration.",
    "authors": [
      "Jeanet A E Brouer",
      "Lisa G Oestergaard",
      "Hans Eiskjær",
      "John Bro-Jeppesen",
      "Lola Qvist Kristensen"
    ],
    "journal": "Journal of the American Heart Association",
    "year": 2025,
    "date": "2025-11-03",
    "abstract": "BACKGROUND: Out-of-hospital cardiac arrest is a significant cause of mortality and morbidity worldwide. Although resuscitation advancements have increased survival, many survivors suffer cognitive impairments that affect their quality of life. Most research has focused on neurological outcomes, whereas little attention has been paid to cognitive function. The aim is to investigate the proportion of cognitive impairment in survivors of out-of-hospital cardiac arrest at discharge and 6 months after cardiac arrest and to investigate the association between the duration of cardiac arrest and level of cognitive function.\nMETHODS: In this prospective cohort study, 184 survivors of out-of-hospital cardiac arrest were assessed using the Montreal Cognitive Assessment screening tool. Duration of cardiac arrest was defined by no flow, low flow, and time to return of spontaneous circulation. Multiple logistic regression analysis provided odds ratios (OR) and CI.\nRESULTS: Of 184 survivors assessed, 26% had normal cognitive function at discharge, increasing to 67% at 6 months (n=149). Median Montreal Cognitive Assessment score improved from 23 (Q25-Q75: 20-26) to 26 (Q25-Q75: 24-28). At 6 months, adjusted ORs per minute were 1.03 (95% CI, 1.00-1.07) for low flow and 1.03 (95% CI, 1.00-1.07) for time to return of spontaneous circulation, whereas associations at discharge were near null (aOR≈0.99). No significant association was found either at discharge or follow-up.\nCONCLUSIONS: Cognitive function improved considerably within 6 months following cardiac arrest, with the proportion of patients exhibiting normal cognitive function increasing from 26% to 67%. This study found no association between the duration of cardiac arrest and cognitive function.",
    "links": {
      "doi": "https://doi.org/10.1161/JAHA.125.042637",
      "pubmed": "https://pubmed.ncbi.nlm.nih.gov/41181996"
    },
    "flags": {
      "open_access": false,
      "has_fulltext": false
    },
    "mesh": [
      "Humans",
      "Out-of-Hospital Cardiac Arrest",
      "Male",
      "Female",
      "Middle Aged",
      "Prospective Studies",
      "Aged",
      "Time Factors",
      "Cognition",
      "Recovery of Function",
      "Cognitive Dysfunction",
      "Return of Spontaneous Circulation",
      "Cardiopulmonary Resuscitation",
      "Mental Status and Dementia Tests",
      "Risk Factors",
      "Quality of Life"
    ],
    "country": "Department of Physiotherapy and Occupational Therapy Aarhus University Hospital Aarhus Denmark"
  },
  {
    "id": "40409672",
    "pmid": "40409672",
    "doi": "10.1016/j.resuscitation.2025.110653",
    "title": "Early ADL ability assessment and cognitive screening as markers of post-discharge outcomes after surviving an out-of-hospital cardiac arrest. A prospective cohort study.",
    "authors": [
      "Lola Qvist Kristensen",
      "Hans Eiskjær",
      "Maurits van Tulder",
      "Eva Elisabet Ejlersen Wæhrens",
      "Lotte Sørensen",
      "John Bro-Jeppesen",
      "Glenn Eastwood",
      "Lisa Gregersen Oestergaard"
    ],
    "journal": "Resuscitation",
    "year": 2025,
    "date": "2025-05-21",
    "abstract": "Background Assessment of activities of daily living (ADL) and cognitive screening are widely used in the care of out-of-hospital cardiac arrest (OHCA) survivors. Evidence linking them to post-discharge outcomes is limited, but could support targeted rehabilitation efforts. Aim To assess whether ADL ability measures and cognitive screening at hospital discharge were associated with post-discharge ADL ability, health-related quality of life (HRQoL) and return to work. Methods This prospective cohort study included 200 OHCA survivors admitted to Aarhus University Hospital. Self-reported ADL ability was measured using the Activities of Daily Living Interview (ADL-I). Observed ADL ability was measured with the Assessment of Motor and Process Skills (AMPS), dichotomised into age-matched or below-ability. Cognitive function was assessed with Montreal Cognitive Assessment (MoCA). Multivariable regressions, with multiple imputation, analysed associations between variables and outcomes, adjusting for age, sex, and comorbidities. Results Adjusted analyses showed significant associations between personal ADL-I (βadjusted = 0.3, 95%CI: 0.2;0.5) and AMPS (βadjusted = -0.6, 95%CI:-1.2;-0.03) at discharge and self-reported ADL ability six months after cardiac arrest. Baseline AMPS was statistically significantly associated with age-matched ADL ability six months after cardiac arrest (ORadjusted 5.5, 95%CI: 1.5;10.0), and personal ADL-I (VAS: βadjusted = 3.00, 95%CI: 1.3;4.6/index score: βadjusted = 0.03, 95%CI 0.01;0.05) and MoCA (index: βadjusted = -0.09, 95%CI: -0.2;-0.02) with HRQoL. The association between MoCA and return to work one-year after cardiac arrest showed an OR of 3.0 (95%CI: 0.5;9.0), although not statistically significant (p = 0.06). Conclusions Decreased ADL ability at hospital discharge was associated with poorer post-discharge outcomes in OHCA survivors, while cognitive screening was also associated with certain aspects of recovery.",
    "links": {
      "doi": "https://doi.org/10.1016/j.resuscitation.2025.110653",
      "pubmed": "https://pubmed.ncbi.nlm.nih.gov/40409672"
    },
    "flags": {
      "open_access": false,
      "has_fulltext": false
    },
    "mesh": [
      "Humans",
      "Male",
      "Female",
      "Out-of-Hospital Cardiac Arrest",
      "Activities of Daily Living",
      "Prospective Studies",
      "Middle Aged",
      "Patient Discharge",
      "Aged",
      "Quality of Life",
      "Cognition",
      "Cognitive Dysfunction",
      "Cardiopulmonary Resuscitation",
      "Mental Status and Dementia Tests",
      "Return to Work",
      "Survivors",
      "Denmark"
    ],
    "country": "Denmark"
  },
  {
    "id": "40619061",
    "pmid": "40619061",
    "doi": "10.1016/j.resuscitation.2025.110708",
    "title": "Early prediction of long-term cognitive function, emotional distress, and health-related quality of life in cardiac arrest survivors.",
    "authors": [
      "A B Glimmerveen",
      "M M L H Verhulst",
      "T Delnoij",
      "J L Bonnes",
      "H M Keijzer",
      "J Hofmeijer",
      "BROCA investigators"
    ],